<?xml version="1.0" encoding="UTF-8"?>
<!DOCTYPE ComponentPackageDescription SYSTEM "deployment.dtd">

<ComponentPackageDescription label="" UUID="">
   <ComponentInterfaceDescription label="" UUID="" specificType="IDL:wamas/stocktake/MainHome:1.0">
      <SupportedType>IDL:wamas/stocktake/MainHome:1.0</SupportedType>
      <SupportedType>IDL:wamas/stocktake/Main:1.0</SupportedType>
      <IdlFile>wamas/stocktake/MainHome.idl</IdlFile>
      <IdlFile>wamas/stocktake/Main.idl</IdlFile>
   </ComponentInterfaceDescription>
   <PackagedComponentImplementation name="myMainHome">
      <ComponentImplementationDescription label="" UUID="">
         <ComponentAssemblyDescription>
            <ComponentAssemblyArtifactDescription label="" UUID="" specificType="IDL:wamas/stocktake/StocktakeAssembly:1.0">
               <Location>wamas/stocktake/assembly/stocktake_assembly.h</Location>
            </ComponentAssemblyArtifactDescription>
         </ComponentAssemblyDescription>
         <MonolithicImplementationDescription>
            <NamedImplementationArtifact name="xy">
               <ImplementationArtifactDescription label="" UUID="">
                  <Location>xy.h</Location>
                  <Location>xy.cc</Location>
               </ImplementationArtifactDescription>
            </NamedImplementationArtifact>
         </MonolithicImplementationDescription>
      </ComponentImplementationDescription>
   </PackagedComponentImplementation>
</ComponentPackageDescription>

